<?xml version="1.0" ?>
<!DOCTYPE Gui SYSTEM "gui.dtd" >
<Gui>
<Dialog keyword="file_selection" modal="true">
<CommandArea keyword="CommandArea">
<Screen keyword="screen1" title="screen1" rows="22" columns="56">
<Array maxLength="20" keyword="FILEBOX_FILES" type="string" clickMode="immediate" editable ="no" columnName="FILES"/>
<Field maxLength="140" keyword="FILEBOX_SELECTION" type="string"/>
<Label keyword="SLabel2" alignment="left">Selection</Label>
<Layout>
<Constraints component="FILEBOX_FILES" xPos="2" yPos="2" xSize="52" ySize="16"/>
<Constraints xSize="9" yStretch="false" ySize="1" xPos="2" yPos="19" component="SLabel2" xStretch="false"/>
<Constraints xSize="50" yStretch="false" ySize="1" xPos="2" yPos="20" component="FILEBOX_SELECTION" xStretch="true"/>
</Layout>
<HelpSection>
</HelpSection>
</Screen>
   <BottomAreaComponent>
    <Screen keyword="BOTTOMSCREEN" title="BottomScreen" rows="2" columns="52">
     <Button keyword="OK"> OK </Button>
     <Button keyword="CANCEL">Cancel</Button>
     <Layout>
      <Constraints component="OK" xPos="1" yPos="0" xSize="6" ySize="1" xStretch="false" yStretch="false"/>
      <Constraints component="CANCEL" xPos="7" yPos="0" xSize="6" ySize="1" xStretch="false" yStretch="false"/>
     </Layout>
     <HelpSection>
     </HelpSection>
    </Screen>
   </BottomAreaComponent>
</CommandArea>
</Dialog>
</Gui>
